{
  "$schema": "../schema/loadout.schema.json",
  "id": "deck-prototype",
  "name": "Aggro",
  "squad": [
    "creature-minotaur",
    "creature-varcolac",
    "creature-warlord-ironhoof"
  ],
  "deckCounts": [
    {
      "cardId": "card-war-axe",
      "copies": 3
    },
    {
      "cardId": "card-twin-blades",
      "copies": 3
    },
    {
      "cardId": "card-whetstone",
      "copies": 3
    },
    {
      "cardId": "card-insignia-of-command",
      "copies": 2
    },
    {
      "cardId": "card-hunters-collar",
      "copies": 2
    },
    {
      "cardId": "card-predators-claws",
      "copies": 2
    },
    {
      "cardId": "card-martial-blessing",
      "copies": 3
    },
    {
      "cardId": "card-wild-echo",
      "copies": 3
    },
    {
      "cardId": "card-rust",
      "copies": 2
    },
    {
      "cardId": "card-opening-cut",
      "copies": 3
    },
    {
      "cardId": "card-press-the-attack",
      "copies": 3
    },
    {
      "cardId": "card-share-the-kill",
      "copies": 2
    },
    {
      "cardId": "card-den-share",
      "copies": 2
    },
    {
      "cardId": "card-dress-ranks",
      "copies": 2
    },
    {
      "cardId": "card-temper",
      "copies": 2
    },
    {
      "cardId": "card-untamed",
      "copies": 2
    },
    {
      "cardId": "card-call-to-arms",
      "copies": 2
    },
    {
      "cardId": "card-pack-law",
      "copies": 2
    },
    {
      "cardId": "card-bloodline-pact",
      "copies": 2
    },
    {
      "cardId": "card-pack-drill",
      "copies": 2
    },
    {
      "cardId": "card-wild-carapace",
      "copies": 2
    },
    {
      "cardId": "card-rending-mark",
      "copies": 1
    }
  ],
  "faceDeck": [
    "face-synthetic-crush",
    "face-synthetic-command",
    "face-synthetic-cleaving-strike",
    "face-synthetic-bloodscent",
    "face-synthetic-gore",
    "face-synthetic-blade-rain"
  ],
  "startingDice": [
    [
      "face-synthetic-crush",
      "face-natural-martial",
      "face-natural-martial",
      "face-natural-wild",
      "face-natural-wild",
      "face-untyped-shield"
    ],
    [
      "face-synthetic-bloodscent",
      "face-natural-martial",
      "face-natural-martial",
      "face-natural-wild",
      "face-natural-wild",
      "face-untyped-shield"
    ]
  ]
}
