{
  "$schema": "../schema/loadout.schema.json",
  "id": "deck-tag-skirmish",
  "name": "Tag Skirmish",
  "squad": ["creature-vega", "creature-magnus", "creature-ryu"],
  "deckCounts": [
    { "cardId": "card-brace", "copies": 2 },
    { "cardId": "card-counter", "copies": 3 },
    { "cardId": "card-parry", "copies": 2 },
    { "cardId": "card-open-palm", "copies": 3 },
    { "cardId": "card-reforge-grip", "copies": 3 },
    { "cardId": "card-vega-drill", "copies": 2 },
    { "cardId": "card-ryu-form", "copies": 2 },
    { "cardId": "card-open-manual", "copies": 3 },
    { "cardId": "card-shift", "copies": 2 },
    { "cardId": "card-call-out", "copies": 3 },
    { "cardId": "card-anchor", "copies": 3 },
    { "cardId": "card-crushing-throw", "copies": 1 },
    { "cardId": "card-air-launcher", "copies": 1 }
  ],
  "faceDeck": [
    "face-natural-jab",
    "face-natural-magnus-grab",
    "face-natural-magnus-lariat",
    "face-natural-magnus-heavy",
    "face-natural-vega-kick",
    "face-natural-vega-dash",
    "face-natural-vega-rush",
    "face-natural-ryu-projectile",
    "face-natural-ryu-focus",
    "face-natural-ryu-charge"
  ],
  "startingDice": [
    [
      "face-natural-jab",
      "face-natural-jab",
      "face-natural-vega-kick",
      "face-natural-vega-dash",
      "face-natural-vega-dash",
      "face-natural-vega-rush"
    ],
    [
      "face-natural-jab",
      "face-natural-magnus-grab",
      "face-natural-magnus-grab",
      "face-natural-magnus-lariat",
      "face-natural-magnus-lariat",
      "face-natural-magnus-heavy"
    ],
    [
      "face-natural-jab",
      "face-natural-ryu-projectile",
      "face-natural-ryu-projectile",
      "face-natural-ryu-focus",
      "face-natural-ryu-focus",
      "face-natural-ryu-charge"
    ]
  ]
}
